<?xml version="1.0" encoding="UTF-8" standalone="yes"?><!DOCTYPE root [
<!ELEMENT root (resource+, path*, time_point*, time_profile*, routed_job*, job*, job_op*, setup_removal_table*, machine*, platform*, connection*)>
<!ELEMENT resource (id_resource, name, resource_type, info1*, info2*)>
<!ELEMENT id_resource (#PCDATA)>
<!ELEMENT resource_type (#PCDATA)>
<!ELEMENT info1 (#PCDATA)>
<!ELEMENT info2 (#PCDATA)>
<!ELEMENT name (#PCDATA)>
<!ELEMENT path (id_path, resource_list_elem+)>
<!ELEMENT resource_list_elem (id_resource)>
<!ELEMENT id_path (#PCDATA)>
<!ELEMENT time_point (id_time_point, processing_time*, perishability_time*,release_no_timeshift*, release_time*, due_date_no_timeshift*, due_date_time*, deadline_no_timeshift*, deadline_time*, weight_obj*, setup_time*, removal_time*, dependent_setup_type*, dependent_removal_type*, route_booking_forward*, route_booking_backward*)>
<!ELEMENT id_time_point (#PCDATA)>
<!ELEMENT processing_time (#PCDATA)>
<!ELEMENT perishability_time (#PCDATA)>
<!ELEMENT release_no_timeshift (#PCDATA)>
<!ELEMENT release_time (#PCDATA)>
<!ELEMENT due_date_no_timeshift (#PCDATA)>
<!ELEMENT due_date_time (#PCDATA)>
<!ELEMENT deadline_no_timeshift (#PCDATA)>
<!ELEMENT deadline_time (#PCDATA)>
<!ELEMENT weight_obj (#PCDATA)>
<!ELEMENT setup_time (#PCDATA)>
<!ELEMENT removal_time (#PCDATA)>
<!ELEMENT dependent_setup_type (#PCDATA)>
<!ELEMENT dependent_removal_type (#PCDATA)>
<!ELEMENT route_booking_forward (#PCDATA)>
<!ELEMENT route_booking_backward (#PCDATA)>
<!ELEMENT time_profile (id_time_profile, id_path, time_point_list_elem+)>
<!ELEMENT time_point_list_elem (id_time_point)>
<!ELEMENT id_time_profile (#PCDATA)>
<!ELEMENT routed_job (id_routed_job, job_type, time_shift, id_time_profile, weight_obj*)>
<!ELEMENT routed_job_list_elem (id_routed_job)>
<!ELEMENT job (id_job, name, routed_job_list_elem+, multiple_routings_list_elem+)>
<!ELEMENT multiple_routings_list_elem (id_resource, time_profile_list_elem+)>
<!ELEMENT time_profile_list_elem (id_time_profile)>
<!ELEMENT id_job (#PCDATA)>
<!ELEMENT id_routed_job (#PCDATA)>
<!ELEMENT job_type (#PCDATA)>
<!ELEMENT time_shift (#PCDATA)>
<!ELEMENT job_op (id_job, operation+)>
<!ELEMENT operation (id_resource, time_point)>
<!ELEMENT setup_removal_table (table_entry+)>
<!ELEMENT table_entry (dependent_type1, dependent_type2,  setup_removal_type, dependent_time)>
<!ELEMENT dependent_type1 (#PCDATA)>
<!ELEMENT dependent_type2 (#PCDATA)>
<!ELEMENT setup_removal_type (#PCDATA)>
<!ELEMENT dependent_time (#PCDATA)>
<!ELEMENT machine (resource_list_elem+)>
<!ELEMENT platform (resource_list_elem+)>
<!ELEMENT connection (id_job_from, id_resource_from, id_job_to, id_resource_to, connection_weight, connection_price, is_passenger)>
<!ELEMENT id_job_from (#PCDATA)>
<!ELEMENT id_resource_from (#PCDATA)>
<!ELEMENT id_job_to (#PCDATA)>
<!ELEMENT id_resource_to (#PCDATA)>
<!ELEMENT connection_weight (#PCDATA)>
<!ELEMENT connection_price (#PCDATA)>
<!ELEMENT is_passenger (#PCDATA)>]><root><resource><id_resource>33</id_resource><name>BIL_3#macchina#8226#332</name><resource_type>blocking</resource_type></resource><resource><id_resource>121</id_resource><name>SCAE-ZB_735#macchina#23621#330</name><resource_type>blocking</resource_type></resource><resource><id_resource>725</id_resource><name>WN_44</name><resource_type>blocking</resource_type></resource><resource><id_resource>468</id_resource><name>WN_43</name><resource_type>blocking</resource_type></resource><resource><id_resource>243</id_resource><name>TW_83_GreatScott_FullPath</name><resource_type>blocking</resource_type></resource><resource><id_resource>119</id_resource><name>SCAE-ZB_735#macchina#23621#335</name><resource_type>blocking</resource_type></resource><resource><id_resource>75</id_resource><name>RG_3#macchina#8224#362</name><resource_type>blocking</resource_type></resource><resource><id_resource>130</id_resource><name>SCAE-ZB_735#macchina#23621#340</name><resource_type>blocking</resource_type></resource><resource><id_resource>111</id_resource><name>SCAE-ZB_735#macchina#23621#345</name><resource_type>blocking</resource_type></resource><resource><id_resource>253</id_resource><name>ZB-NOU_557</name><resource_type>blocking</resource_type></resource><resource><id_resource>62</id_resource><name>ZEN_2#macchina#18226#750</name><resource_type>blocking</resource_type></resource><resource><id_resource>202</id_resource><name>HGO_4_GreatScott_FullPath</name><resource_type>blocking</resource_type></resource><resource><id_resource>689</id_resource><name>BRAG_23</name><resource_type>blocking</resource_type></resource><resource><id_resource>509</id_resource><name>BRAG_24</name><resource_type>blocking</resource_type></resource><resource><id_resource>1114</id_resource><name>ZG_83</name><resource_type>blocking</resource_type></resource><resource><id_resource>165</id_resource><name>ZWIE_1#macchina#18823#37</name><resource_type>blocking</resource_type></resource><resource><id_resource>587</id_resource><name>ZG_85</name><resource_type>blocking</resource_type></resource><resource><id_resource>584</id_resource><name>ZG_84</name><resource_type>blocking</resource_type></resource><resource><id_resource>706</id_resource><name>FMS-WAL_112</name><resource_type>blocking</resource_type></resource><resource><id_resource>147</id_resource><name>RI_1#macchina#18224#525</name><resource_type>blocking</resource_type></resource><resource><id_resource>133</id_resource><name>HGO_94</name><resource_type>blocking</resource_type></resource><resource><id_resource>28</id_resource><name>BGH_2#macchina#19322#25</name><resource_type>blocking</resource_type></resource><resource><id_resource>314</id_resource><name>LA_2#macchina#20523#282</name><resource_type>blocking</resource_type></resource><resource><id_resource>603</id_resource><name>LITT_91</name><resource_type>blocking</resource_type></resource><resource><id_resource>286</id_resource><name>LITT_92</name><resource_type>blocking</resource_type></resource><resource><id_resource>126</id_resource><name>SCAE-ZB_735#macchina#23428#350</name><resource_type>blocking</resource_type></resource><resource><id_resource>840</id_resource><name>ZEN_61</name><resource_type>blocking</resource_type></resource><resource><id_resource>500</id_resource><name>MELS-SA_201</name><resource_type>blocking</resource_type></resource><resource><id_resource>178</id_resource><name>LQ_3#macchina#560#67</name><resource_type>blocking</resource_type></resource><resource><id_resource>492</id_resource><name>FMS_84</name><resource_type>blocking</resource_type></resource><resource><id_resource>705</id_resource><name>FMS_83</name><resource_type>blocking</resource_type></resource><resource><id_resource>902</id_resource><name>ZEN_62</name><resource_type>blocking</resource_type></resource><resource><id_resource>124</id_resource><name>SCAE-ZB_735#macchina#23621#325</name><resource_type>blocking</resource_type></resource><resource><id_resource>66</id_resource><name>BAA_1#macchina#20425#257</name><resource_type>blocking</resource_type></resource><resource><id_resource>72</id_resource><name>ZG_3#macchina#2408#12</name><resource_type>blocking</resource_type></resource><resource><id_resource>396</id_resource><name>ORD-HG_113</name><resource_type>blocking</resource_type></resource><resource><id_resource>129</id_resource><name>SCAE-ZB_735#macchina#23428#340</name><resource_type>blocking</resource_type></resource><resource><id_resource>127</id_resource><name>SCAE-ZB_735#macchina#23428#345</name><resource_type>blocking</resource_type></resource><resource><id_resource>162</id_resource><name>ZWIE_1#macchina#18225#37</name><resource_type>blocking</resource_type></resource><resource><id_resource>663</id_resource><name>RW_7</name><resource_type>blocking</resource_type></resource><resource><id_resource>917</id_resource><name>ZUE_T34-A</name><resource_type>blocking</resource_type></resource><resource><id_resource>918</id_resource><name>ZUE_T34-B</name><resource_type>blocking</resource_type></resource><resource><id_resource>831</id_resource><name>ZAU_11</name><resource_type>blocking</resource_type></resource><resource><id_resource>220</id_resource><name>HGO_73</name><resource_type>blocking</resource_type></resource><resource><id_resource>911</id_resource><name>ZAU_12</name><resource_type>blocking</resource_type></resource><resource><id_resource>378</id_resource><name>ZAU_14</name><resource_type>blocking</resource_type></resource><resource><id_resource>634</id_resource><name>ZAU_15</name><resource_type>blocking</resource_type></resource><resource><id_resource>55</id_resource><name>HGO_74</name><resource_type>blocking</resource_type></resource><resource><id_resource>486</id_resource><name>MOLS-WAL_214</name><resource_type>blocking</resource_type></resource><resource><id_resource>84</id_resource><name>SA_3#macchina#913#582</name><resource_type>blocking</resource_type></resource><resource><id_resource>280</id_resource><name>SA_5#macchina#23432#585</name><resource_type>blocking</resource_type></resource><resource><id_resource>160</id_resource><name>ZWIE_1#macchina#20425#37</name><resource_type>blocking</resource_type></resource><resource><id_resource>113</id_resource><name>SCAE-ZB_735#macchina#23428#330</name><resource_type>blocking</resource_type></resource><resource><id_resource>176</id_resource><name>LQ_3#macchina#562#67</name><resource_type>blocking</resource_type></resource><resource><id_resource>120</id_resource><name>SCAE-ZB_735#macchina#23428#335</name><resource_type>blocking</resource_type></resource><resource><id_resource>102</id_resource><name>WAE_52#macchina#18824#112</name><resource_type>blocking</resource_type></resource><resource><id_resource>735</id_resource><name>BIL_73</name><resource_type>blocking</resource_type></resource><resource><id_resource>457</id_resource><name>BIL_74</name><resource_type>blocking</resource_type></resource><resource><id_resource>703</id_resource><name>FMS_33</name><resource_type>blocking</resource_type></resource><resource><id_resource>114</id_resource><name>SCAE-ZB_735#macchina#23621#350</name><resource_type>blocking</resource_type></resource><resource><id_resource>155</id_resource><name>ALTD_2#macchina#18223#322</name><resource_type>blocking</resource_type></resource><resource><id_resource>38</id_resource><name>BAE_1#macchina#18825#277</name><resource_type>blocking</resource_type></resource><resource><id_resource>149</id_resource><name>LITT_62</name><resource_type>blocking</resource_type></resource><resource><id_resource>321</id_resource><name>AU_4#macchina#18825#212</name><resource_type>blocking</resource_type></resource><resource><id_resource>604</id_resource><name>LITT_61</name><resource_type>blocking</resource_type></resource><resource><id_resource>193</id_resource><name>HG_3</name><resource_type>blocking</resource_type></resource><resource><id_resource>67</id_resource><name>BAA_1</name><resource_type>blocking</resource_type></resource><resource><id_resource>470</id_resource><name>WN-MH_227</name><resource_type>blocking</resource_type></resource><resource><id_resource>471</id_resource><name>WN-MH_226</name><resource_type>blocking</resource_type></resource><resource><id_resource>306</id_resource><name>HG_4</name><resource_type>blocking</resource_type></resource><resource><id_resource>19</id_resource><name>BAA_3</name><resource_type>blocking</resource_type></resource><resource><id_resource>469</id_resource><name>WN-MH_228</name><resource_type>blocking</resource_type></resource><resource><id_resource>905</id_resource><name>ZEN_12</name><resource_type>blocking</resource_type></resource><resource><id_resource>837</id_resource><name>ZEN_11</name><resource_type>blocking</resource_type></resource><resource><id_resource>97</id_resource><name>WAE_52#macchina#18226#555</name><resource_type>blocking</resource_type></resource><resource><id_resource>87</id_resource><name>SA_3#macchina#5061#582</name><resource_type>blocking</resource_type></resource><resource><id_resource>115</id_resource><name>SCAE-ZB_735</name><resource_type>blocking</resource_type></resource><resource><id_resource>783</id_resource><name>WAE-AU_223</name><resource_type>blocking</resource_type></resource><resource><id_resource>784</id_resource><name>WAE-AU_222</name><resource_type>blocking</resource_type></resource><resource><id_resource>785</id_resource><name>WAE-AU_221</name><resource_type>blocking</resource_type></resource><resource><id_resource>46</id_resource><name>FMS_4#macchina#23428#537</name><resource_type>blocking</resource_type></resource><resource><id_resource>47</id_resource><name>FMS_4#macchina#23428#535</name><resource_type>blocking</resource_type></resource><resource><id_resource>574</id_resource><name>BAAN_1</name><resource_type>blocking</resource_type></resource><resource><id_resource>596</id_resource><name>BAAN_2</name><resource_type>blocking</resource_type></resource><resource><id_resource>368</id_resource><name>dummy</name><resource_type>blocking</resource_type></resource><resource><id_resource>617</id_resource><name>TW_55</name><resource_type>blocking</resource_type></resource><resource><id_resource>164</id_resource><name>ZWIE_1#macchina#18825#37</name><resource_type>blocking</resource_type></resource><resource><id_resource>18</id_resource><name>BAA_3#macchina#20424#52</name><resource_type>blocking</resource_type></resource><resource><id_resource>800</id_resource><name>TW_56</name><resource_type>blocking</resource_type></resource><resource><id_resource>198</id_resource><name>RUES_1</name><resource_type>blocking</resource_type></resource><resource><id_resource>32</id_resource><name>BIL_3#macchina#8224#332</name><resource_type>blocking</resource_type></resource><resource><id_resource>137</id_resource><name>RUES_2</name><resource_type>blocking</resource_type></resource><resource><id_resource>1056</id_resource><name>PF_66</name><resource_type>blocking</resource_type></resource><resource><id_resource>494</id_resource><name>FMS_24</name><resource_type>blocking</resource_type></resource><resource><id_resource>948</id_resource><name>UZ_2</name><resource_type>blocking</resource_type></resource><resource><id_resource>625</id_resource><name>NIDB_N13</name><resource_type>blocking</resource_type></resource><resource><id_resource>360</id_resource><name>TW_63</name><resource_type>blocking</resource_type></resource><resource><id_resource>1011</id_resource><name>20424#1</name><resource_type>multiple_routings</resource_type></resource><resource><id_resource>542</id_resource><name>TW_64</name><resource_type>blocking</resource_type></resource><resource><id_resource>320</id_resource><name>AU_4#macchina#18823#212</name><resource_type>blocking</resource_type></resource><resource><id_resource>387</id_resource><name>NIDB_N12</name><resource_type>blocking</resource_type></resource><resource><id_resource>143</id_resource><name>RI_1#macchina#18226#525</name><resource_type>blocking</resource_type></resource><resource><id_resource>36</id_resource><name>SBG_3</name><resource_type>blocking</resource_type></resource><resource><id_resource>558</id_resource><name>SBG_4</name><resource_type>blocking</resource_type></resource><resource><id_resource>1055</id_resource><name>PF_76</name><resource_type>blocking</resource_type></resource><resource><id_resource>692</id_resource><name>SA_32</name><resource_type>blocking</resource_type></resource><resource><id_resource>506</id_resource><name>SA_33</name><resource_type>blocking</resource_type></resource><resource><id_resource>657</id_resource><name>PF_79</name><resource_type>blocking</resource_type></resource><resource><id_resource>179</id_resource><name>LQ_3#macchina#912#67</name><resource_type>blocking</resource_type></resource><resource><id_resource>621</id_resource><name>TW_26</name><resource_type>blocking</resource_type></resource><resource><id_resource>658</id_resource><name>PF_72</name><resource_type>blocking</resource_type></resource><resource><id_resource>655</id_resource><name>PF_73</name><resource_type>blocking</resource_type></resource><resource><id_resource>656</id_resource><name>PF_74</name><resource_type>blocking</resource_type></resource><resource><id_resource>427</id_resource><name>PF_75</name><resource_type>blocking</resource_type></resource><resource><id_resource>168</id_resource><name>LITT_11</name><resource_type>blocking</resource_type></resource><resource><id_resource>215</id_resource><name>TW_3</name><resource_type>blocking</resource_type></resource><resource><id_resource>357</id_resource><name>TW_33</name><resource_type>blocking</resource_type></resource><resource><id_resource>11</id_resource><name>SIB_3#macchina#20528#402</name><resource_type>blocking</resource_type></resource><resource><id_resource>762</id_resource><name>ALTD-PF_235</name><resource_type>blocking</resource_type></resource><resource><id_resource>159</id_resource><name>ZWIE_1#macchina#18223#37</name><resource_type>blocking</resource_type></resource><resource><id_resource>761</id_resource><name>ALTD-PF_236</name><resource_type>blocking</resource_type></resource><resource><id_resource>296</id_resource><name>RG_4#macchina#8221#412</name><resource_type>blocking</resource_type></resource><resource><id_resource>267</id_resource><name>TW_6</name><resource_type>blocking</resource_type></resource><resource><id_resource>291</id_resource><name>TW_5</name><resource_type>blocking</resource_type></resource><resource><id_resource>339</id_resource><name>TW_4</name><resource_type>blocking</resource_type></resource><resource><id_resource>774</id_resource><name>HAF-RI_228</name><resource_type>blocking</resource_type></resource><resource><id_resource>593</id_resource><name>ZG_13</name><resource_type>blocking</resource_type></resource><resource><id_resource>662</id_resource><name>PF-RW_703</name><resource_type>blocking</resource_type></resource><resource><id_resource>553</id_resource><name>HGO-SBG_416</name><resource_type>blocking</resource_type></resource><resource><id_resource>54</id_resource><name>HGO_74_GreatScott_FullPath</name><resource_type>blocking</resource_type></resource><resource><id_resource>151</id_resource><name>HGO-SBG_418</name><resource_type>blocking</resource_type></resource><resource><id_resource>246</id_resource><name>HGO-SBG_417</name><resource_type>blocking</resource_type></resource><resource><id_resource>763</id_resource><name>PF_83</name><resource_type>blocking</resource_type></resource><resource><id_resource>577</id_resource><name>ZG_18</name><resource_type>blocking</resource_type></resource><resource><id_resource>252</id_resource><name>HGO_3#macchina#20425#177</name><resource_type>blocking</resource_type></resource><resource><id_resource>163</id_resource><name>ZWIE_1#macchina#20423#37</name><resource_type>blocking</resource_type></resource><resource><id_resource>428</id_resource><name>PF_85</name><resource_type>blocking</resource_type></resource><resource><id_resource>386</id_resource><name>ZKOL-NIDB_157</name><resource_type>blocking</resource_type></resource><resource><id_resource>384</id_resource><name>ZKOL-NIDB_155</name><resource_type>blocking</resource_type></resource><resource><id_resource>620</id_resource><name>TW_45</name><resource_type>blocking</resource_type></resource><resource><id_resource>385</id_resource><name>ZKOL-NIDB_156</name><resource_type>blocking</resource_type></resource><resource><id_resource>802</id_resource><name>TW_46</name><resource_type>blocking</resource_type></resource><resource><id_resource>382</id_resource><name>ZKOL-NIDB_153</name><resource_type>blocking</resource_type></resource><resource><id_resource>383</id_resource><name>ZKOL-NIDB_154</name><resource_type>blocking</resource_type></resource><resource><id_resource>251</id_resource><name>HGO_3#macchina#20423#177</name><resource_type>blocking</resource_type></resource><resource><id_resource>169</id_resource><name>LITT_11_GreatScott_1</name><resource_type>blocking</resource_type></resource><resource><id_resource>263</id_resource><name>ZWOL_4</name><resource_type>blocking</resource_type></resource><resource><id_resource>594</id_resource><name>BAAL_3</name><resource_type>blocking</resource_type></resource><resource><id_resource>81</id_resource><name>ZWOL_3</name><resource_type>blocking</resource_type></resource><resource><id_resource>203</id_resource><name>HGO_4_GreatScott_FullPath#macchina#20424#132</name><resource_type>blocking</resource_type></resource><resource><id_resource>576</id_resource><name>BAAL_2</name><resource_type>blocking</resource_type></resource><resource><id_resource>223</id_resource><name>SIB_4#macchina#18223#370</name><resource_type>blocking</resource_type></resource><resource><id_resource>794</id_resource><name>HG-ORD_213</name><resource_type>blocking</resource_type></resource><resource><id_resource>793</id_resource><name>HG_23</name><resource_type>blocking</resource_type></resource><resource><id_resource>595</id_resource><name>ZG-BAA_428</name><resource_type>blocking</resource_type></resource><resource><id_resource>397</id_resource><name>HG_24</name><resource_type>blocking</resource_type></resource><resource><id_resource>299</id_resource><name>WAE_3#macchina#20523#182</name><resource_type>blocking</resource_type></resource><resource><id_resource>146</id_resource><name>RI_1#macchina#18826#87</name><resource_type>blocking</resource_type></resource><resource><id_resource>3</id_resource><name>ZWIE_2#macchina#18226#770</name><resource_type>blocking</resource_type></resource><resource><id_resource>652</id_resource><name>PF_22</name><resource_type>blocking</resource_type></resource><resource><id_resource>348</id_resource><name>BIL_4#macchina#8223#442</name><resource_type>blocking</resource_type></resource><resource><id_resource>766</id_resource><name>PF_23</name><resource_type>blocking</resource_type></resource><resource><id_resource>294</id_resource><name>RG_4#macchina#8223#412</name><resource_type>blocking</resource_type></resource><resource><id_resource>578</id_resource><name>ZG_32</name><resource_type>blocking</resource_type></resource><resource><id_resource>424</id_resource><name>PF_25</name><resource_type>blocking</resource_type></resource><resource><id_resource>592</id_resource><name>ZG_33</name><resource_type>blocking</resource_type></resource><resource><id_resource>466</id_resource><name>WN_73</name><resource_type>blocking</resource_type></resource><resource><id_resource>174</id_resource><name>RI_2#macchina#18825#262</name><resource_type>blocking</resource_type></resource><resource><id_resource>356</id_resource><name>TW_23</name><resource_type>blocking</resource_type></resource><resource><id_resource>390</id_resource><name>TW_24</name><resource_type>blocking</resource_type></resource><resource><id_resource>622</id_resource><name>TW_25</name><resource_type>blocking</resource_type></resource><resource><id_resource>977</id_resource><name>20426#1</name><resource_type>multiple_routings</resource_type></resource><resource><id_resource>454</id_resource><name>RG-BIL_153</name><resource_type>blocking</resource_type></resource><resource><id_resource>453</id_resource><name>RG-BIL_152</name><resource_type>blocking</resource_type></resource><resource><id_resource>591</id_resource><name>ZG_43</name><resource_type>blocking</resource_type></resource><resource><id_resource>458</id_resource><name>BIL-ZB_155</name><resource_type>blocking</resource_type></resource><resource><id_resource>579</id_resource><name>ZG_42</name><resource_type>blocking</resource_type></resource><resource><id_resource>452</id_resource><name>RG-BIL_151</name><resource_type>blocking</resource_type></resource><resource><id_resource>76</id_resource><name>RG_3#macchina#8226#362</name><resource_type>blocking</resource_type></resource><resource><id_resource>324</id_resource><name>SCBU_2#macchina#8221#392</name><resource_type>blocking</resource_type></resource><resource><id_resource>419</id_resource><name>BAE-FRB_130</name><resource_type>blocking</resource_type></resource><resource><id_resource>216</id_resource><name>TW_3#macchina#5059#87</name><resource_type>blocking</resource_type></resource><resource><id_resource>420</id_resource><name>BAE-FRB_131</name><resource_type>blocking</resource_type></resource><resource><id_resource>20</id_resource><name>BAA_3#macchina#20426#52</name><resource_type>blocking</resource_type></resource><resource><id_resource>39</id_resource><name>BAE_1</name><resource_type>blocking</resource_type></resource><resource><id_resource>772</id_resource><name>BAE_2</name><resource_type>blocking</resource_type></resource><resource><id_resource>414</id_resource><name>WAE-RI_126</name><resource_type>blocking</resource_type></resource><resource><id_resource>413</id_resource><name>WAE-RI_125</name><resource_type>blocking</resource_type></resource><resource><id_resource>154</id_resource><name>ALTD_2#macchina#18225#322</name><resource_type>blocking</resource_type></resource><resource><id_resource>307</id_resource><name>HG_4#macchina#18223#187</name><resource_type>blocking</resource_type></resource><resource><id_resource>877</id_resource><name>ZG_51</name><resource_type>blocking</resource_type></resource><resource><id_resource>673</id_resource><name>CH-ZIZS_419</name><resource_type>blocking</resource_type></resource><resource><id_resource>302</id_resource><name>WAE_3#macchina#18823#237</name><resource_type>blocking</resource_type></resource><resource><id_resource>674</id_resource><name>CH-ZIZS_417</name><resource_type>blocking</resource_type></resource><resource><id_resource>852</id_resource><name>KIL-RUES_107</name><resource_type>blocking</resource_type></resource><resource><id_resource>210</id_resource><name>ZG_4#macchina#2629#295</name><resource_type>blocking</resource_type></resource><resource><id_resource>92</id_resource><name>PF-FRBS_604#macchina#16922#40</name><resource_type>blocking</resource_type></resource><resource><id_resource>958</id_resource><name>ZB_60</name><resource_type>blocking</resource_type></resource><resource><id_resource>334</id_resource><name>TW_4#macchina#2631#87</name><resource_type>blocking</resource_type></resource><resource><id_resource>1058</id_resource><name>PF_6-B</name><resource_type>blocking</resource_type></resource><resource><id_resource>1057</id_resource><name>PF_6-A</name><resource_type>blocking</resource_type></resource><resource><id_resource>327</id_resource><name>ZG_5#macchina#2624#12</name><resource_type>blocking</resource_type></resource><resource><id_resource>624</id_resource><name>NIDB_N94</name><resource_type>blocking</resource_type></resource><resource><id_resource>696</id_resource><name>SA_81</name><resource_type>blocking</resource_type></resource><resource><id_resource>388</id_resource><name>NIDB_N91</name><resource_type>blocking</resource_type></resource><resource><id_resource>501</id_resource><name>SA_82</name><resource_type>blocking</resource_type></resource><resource><id_resource>41</id_resource><name>MELS_4</name><resource_type>blocking</resource_type></resource><resource><id_resource>791</id_resource><name>HG_93</name><resource_type>blocking</resource_type></resource><resource><id_resource>235</id_resource><name>SA_2#macchina#558#132</name><resource_type>blocking</resource_type></resource><resource><id_resource>399</id_resource><name>HG_94</name><resource_type>blocking</resource_type></resource><resource><id_resource>158</id_resource><name>TW-ORD_110_GreatScott_FullPath</name><resource_type>blocking</resource_type></resource><resource><id_resource>959</id_resource><name>ZB_75</name><resource_type>blocking</resource_type></resource><resource><id_resource>699</id_resource><name>MELS_3</name><resource_type>blocking</resource_type></resource><resource><id_resource>212</id_resource><name>TW_3#macchina#18225#142</name><resource_type>blocking</resource_type></resource><resource><id_resource>96</id_resource><name>WAE_52#macchina#18826#112</name><resource_type>blocking</resource_type></resource><resource><id_resource>845</id_resource><name>ZWOL_84</name><resource_type>blocking</resource_type></resource><resource><id_resource>897</id_resource><name>ZWOL_83</name><resource_type>blocking</resource_type></resource><resource><id_resource>728</id_resource><name>ZB_86</name><resource_type>blocking</resource_type></resource><resource><id_resource>712</id_resource><name>MOLS-UNT_115</name><resource_type>blocking</resource_type></resource><resource><id_resource>671</id_resource><name>CH-ZIZS_422</name><resource_type>blocking</resource_type></resource><resource><id_resource>670</id_resource><name>CH-ZIZS_424</name><resource_type>blocking</resource_type></resource><resource><id_resource>463</id_resource><name>ZB_89</name><resource_type>blocking</resource_type></resource><resource><id_resource>672</id_resource><name>CH-ZIZS_420</name><resource_type>blocking</resource_type></resource><resource><id_resource>636</id_resource><name>ZAU-ZUE_251</name><resource_type>blocking</resource_type></resource><resource><id_resource>188</id_resource><name>KIL_2#macchina#20426#247</name><resource_type>blocking</resource_type></resource><resource><id_resource>94</id_resource><name>ZG_1#macchina#20423#295</name><resource_type>blocking</resource_type></resource><resource><id_resource>17</id_resource><name>SIB_3#macchina#18226#402</name><resource_type>blocking</resource_type></resource><resource><id_resource>224</id_resource><name>SIB_4#macchina#20527#312</name><resource_type>blocking</resource_type></resource><resource><id_resource>660</id_resource><name>PF_98</name><resource_type>blocking</resource_type></resource><resource><id_resource>844</id_resource><name>ZWOL_74</name><resource_type>blocking</resource_type></resource><resource><id_resource>898</id_resource><name>ZWOL_73</name><resource_type>blocking</resource_type></resource><resource><id_resource>70</id_resource><name>WAL_3#macchina#5061#517</name><resource_type>blocking</resource_type></resource><resource><id_resource>230</id_resource><name>LA_3#macchina#20528#430</name><resource_type>blocking</resource_type></resource><res